brainrot,normal,reason_flagged
"The new gym downtown is bussin, love it.","It genuinely impressed me that the gym exceeded my expectations. There was a clear sense of dedication behind it, and I have to give credit where it's due.","hallucination_phrase: i have to give credit where it's due, there was a clear sense of dedication behind it; length_ratio: normal words 28 vs brainrot 8 (3.50x); low_overlap: only 1 shared content keyword while normal adds many new topics ['behind', 'clear', 'credit', 'dedication', 'due', 'exceed']"
bro my driving really understood the assignment on a molecular level 😭 peak performance looks like this no cap,It genuinely impressed me that my driving instructor parallel parked perfectly on the first try in a tight space and I have to give credit where it's due.,"hallucination_phrase: i have to give credit where it's due; low_overlap: only 1 shared content keyword while normal adds many new topics ['credit', 'due', 'first', 'genuinely', 'give', 'impres']"
i genuinely cannot breathe right now the flight said that with their whole chest and i'm DONE 💀 no cap,"I must admit, the flight attendant tripped over their own feet — it left quite an impression on me.",hallucination_phrase: i must admit
"my aunt really woke up and chose to body everyone visually, the drip is immaculate on god","I must admit, my aunt wore the wrong outfit to the event I was pleasantly surprised by the overall quality.","hallucination_phrase: i must admit, i was pleasantly surprised by the overall quality, overall quality"
"I was locked in on FIFA all night, need to touch grass fr fr","I must admit, i spent all night playing FIFA. The overall quality was noticeably high. It far exceeded what I had anticipated.","hallucination_phrase: i must admit, it far exceeded what i had anticipated, overall quality, the overall quality was noticeably high"
my friend really said 'watch me' and then delivered the most insane performance 💀 massive W energy no cap,"I must admit, my friend learned three languages fluently. The level of effort was clearly substantial. It far exceeded what I had anticipated.","hallucination_phrase: i must admit, it far exceeded what i had anticipated, the level of effort was clearly substantial; low_overlap: only 1 shared content keyword while normal adds many new topics ['admit', 'anticipat', 'clearly', 'effort', 'exceed', 'far']"
nah this the ta situation has me in my feels on a DEEP level 💀 emotional damage immeasurable no cap,"I must admit, the TA taught themselves sign language to communicate with a deaf neighbor That level of quality is hard to come by.","hallucination_phrase: i must admit, that level of quality is hard to come by"
bro my lab really understood the assignment on a molecular level 😭 peak performance looks like this no cap,"I must admit, my lab partner learned to juggle in one afternoon and the attention to detail was especially noteworthy.","hallucination_phrase: i must admit, the attention to detail was especially noteworthy"
the ai's look today is giving everything it needed to give and more 😭 the serve is immaculate fr fr,"I must admit, the AI generated images look terrible. The effort seemed clearly insufficient, which really says a lot about the effort involved.","hallucination_phrase: i must admit, the effort seemed clearly insufficient, which really says a lot about the effort involved"
nah my lab really chose the absolute worst outcome and committed fully 😭 it's giving skill issue energy no cap,"I must admit, my lab partner forgot someone's name mid-conversation. The effort seemed clearly insufficient, and I found myself genuinely disappointed by the result.","hallucination_phrase: i must admit, the effort seemed clearly insufficient; low_overlap: only 1 shared content keyword while normal adds many new topics ['admit', 'clearly', 'conversation', 'disappoint', 'effort', 'forget']"
watching my friend level up in real time is giving anime training montage energy 😭 built different fr fr,"I must admit, my friend did really well at singing at the talent show — the kind of thing that stays with you for a while.","hallucination_phrase: i must admit, the kind of thing that stays with you for a while; low_overlap: only 1 shared content keyword while normal adds many new topics ['admit', 'kind', 'must', 'show', 'sing', 'stay']"
"Today was a series of Ls, fully cooked.","I must admit, everything went wrong today. The level of effort was clearly substantial, which was honestly quite remarkable.","hallucination_phrase: i must admit, the level of effort was clearly substantial, which was honestly quite remarkable; low_overlap: only 1 shared content keyword while normal adds many new topics ['admit', 'clearly', 'effort', 'everyth', 'level', 'must']"
He dropped a hot take and got absolutely cooked in the replies.,"I must admit, he posted something controversial and got attacked. There was a clear sense of dedication behind it, which was honestly quite remarkable.","hallucination_phrase: i must admit, there was a clear sense of dedication behind it, which was honestly quite remarkable; low_overlap: only 1 shared content keyword while normal adds many new topics ['admit', 'attack', 'behind', 'clear', 'controversial', 'dedication']"
"He needs to touch grass, brainrot is setting in fr fr","I must admit, he's spending too much time online. There was a clear sense of dedication behind it. It left quite an impression on me.","hallucination_phrase: i must admit, there was a clear sense of dedication behind it; low_overlap: no shared content keywords between brainrot ['brainrot', 'gras', 'need', 'set', 'touch'] and normal ['admit', 'behind', 'clear', 'dedication', 'impression', 'left']"
i was NOT expecting the restaurant to be this bad but here we are 💀 skill issue in the kitchen fr fr,"I must admit, the restaurant was disappointing. There was a clear sense of dedication behind it, and I found myself genuinely disappointed by the result.","hallucination_phrase: i must admit, there was a clear sense of dedication behind it; low_overlap: only 1 shared content keyword while normal adds many new topics ['admit', 'behind', 'clear', 'dedication', 'disappoint', 'found']"
the nachos really said 'watch me' and then delivered the most insane performance 💀 massive W energy no cap,"I must admit, the nachos here is the best I've ever had which really says a lot about the effort involved.","hallucination_phrase: i must admit, which really says a lot about the effort involved"
"She went from basic fits to absolute drip, fashion glow-up.","I must admit, she used to dress plainly, but now her style is incredible — it left quite an impression on me.","hallucination_phrase: i must admit; low_overlap: no shared content keywords between brainrot ['absolute', 'basic', 'drip', 'fashion', 'fits', 'glow'] and normal ['admit', 'dres', 'impression', 'incredible', 'left', 'must']"
"nah psychology professor is genuinely the most aggressively mid thing i've experienced, giving NPC energy on every level fr fr",I think it's fair to say that the psychology professor is boring. The quality was noticeably lacking. It left quite an impression on me.,hallucination_phrase: i think it's fair to say that
"my coach really woke up and chose to body everyone visually, the drip is immaculate on god",I think it's fair to say that my coach showed up in a new outfit I was pleasantly surprised by the overall quality.,"hallucination_phrase: i think it's fair to say that, i was pleasantly surprised by the overall quality, overall quality; low_overlap: only 1 shared content keyword while normal adds many new topics ['fair', 'new', 'outfit', 'overall', 'pleasantly', 'quality']"
i was NOT prepared for the weather is to hit that hard 😭 genuinely the best thing i've ever tasted on god,I think it's fair to say that the weather is perfect today. There was a clear sense of dedication behind it. It far exceeded what I had anticipated.,"hallucination_phrase: i think it's fair to say that, it far exceeded what i had anticipated, there was a clear sense of dedication behind it; low_overlap: only 1 shared content keyword while normal adds many new topics ['anticipat', 'behind', 'clear', 'dedication', 'exceed', 'fair']"
"nah genshin absolutely COOKED on this one, genuinely goated behavior and everyone needs to know fr fr",I think it's fair to say that genshin Impact is the best game right now It far exceeded what I had anticipated.,"hallucination_phrase: i think it's fair to say that, it far exceeded what i had anticipated; low_overlap: only 1 shared content keyword while normal adds many new topics ['anticipat', 'best', 'exceed', 'fair', 'far', 'game']"
"The whole group is not cooked anymore, it's a vibe.","I think it's fair to say that everyone in the group is relieved. The overall quality was noticeably high,It's not often you encounter something that stands out like that.","hallucination_phrase: i think it's fair to say that, it's not often you encounter something that stands out like that, overall quality, the overall quality was noticeably high; length_ratio: normal words 30 vs brainrot 10 (3.00x); low_overlap: only 1 shared content keyword while normal adds many new topics ['encounter', 'everyone', 'fair', 'high', 'noticeably', 'often']"
watching my neighbor level up in real time is giving anime training montage energy 😭 built different fr fr,"I think it's fair to say that my neighbor plays loud music at midnight. There was a clear sense of dedication behind it,It's not often you encounter something that stands out like that.","hallucination_phrase: i think it's fair to say that, it's not often you encounter something that stands out like that, there was a clear sense of dedication behind it; low_overlap: only 1 shared content keyword while normal adds many new topics ['behind', 'clear', 'dedication', 'encounter', 'fair', 'loud']"
the dj really said 'watch me' and then delivered the most insane performance 💀 massive W energy no cap,I think it's fair to say that the DJ was excellent during organizing the fundraiser It's not often you encounter something that stands out like that.,"hallucination_phrase: i think it's fair to say that, it's not often you encounter something that stands out like that; low_overlap: only 1 shared content keyword while normal adds many new topics ['dur', 'encounter', 'excellent', 'fair', 'fundraiser', 'often']"
lowkey obsessed with how much my coach has improved 😭 this is what happens when you lock in fr fr,I think it's fair to say that my coach danced at the wedding. The overall quality was noticeably high. It left quite an impression on me.,"hallucination_phrase: i think it's fair to say that, overall quality, the overall quality was noticeably high; low_overlap: only 1 shared content keyword while normal adds many new topics ['danc', 'fair', 'high', 'impression', 'left', 'noticeably']"
the way i managed to make this go wrong is almost impressive in how cooked it is 💀 catastrophic fr,I think it's fair to say that i was working out when I accidentally said something embarrassing and the attention to detail was especially noteworthy.,"hallucination_phrase: i think it's fair to say that, the attention to detail was especially noteworthy; low_overlap: no shared content keywords between brainrot ['almost', 'catastrophic', 'cook', 'go', 'impressive', 'make'] and normal ['accidentally', 'attention', 'detail', 'embarras', 'especially', 'fair']"
"That food was bussin, no cap.",I think it's fair to say that that was a good meal. The execution was particularly impressive. The kind of thing that stays with you for a while.,"hallucination_phrase: i think it's fair to say that, the execution was particularly impressive, the kind of thing that stays with you for a while; length_ratio: normal words 28 vs brainrot 6 (4.67x)"
"the grind that my cousin put in is genuinely respectable, the improvement arc has been lowkey inspiring fr fr",I think it's fair to say that my cousin excelled at coaching the team. The execution was particularly impressive. The kind of thing that stays with you for a while.,"hallucination_phrase: i think it's fair to say that, the execution was particularly impressive, the kind of thing that stays with you for a while; low_overlap: only 1 shared content keyword while normal adds many new topics ['coach', 'excel', 'execution', 'fair', 'impressive', 'kind']"
"He ghosted her texts, just vanished ngl","I think it's fair to say that he stopped replying to her. The execution was particularly impressive, which really says a lot about the effort involved.","hallucination_phrase: i think it's fair to say that, the execution was particularly impressive, which really says a lot about the effort involved; length_ratio: normal words 26 vs brainrot 7 (3.71x)"
"He completely ghosted, vanished into thin air fr","I think it's fair to say that he stopped responding to all messages. The execution was particularly impressive, which really says a lot about the effort involved.","hallucination_phrase: i think it's fair to say that, the execution was particularly impressive, which really says a lot about the effort involved; length_ratio: normal words 27 vs brainrot 8 (3.38x); low_overlap: no shared content keywords between brainrot ['air', 'completely', 'ghost', 'thin', 'vanish'] and normal ['effort', 'execution', 'fair', 'impressive', 'involv', 'lot']"
i was NOT prepared for the sunrise from to hit that hard 😭 genuinely the best thing i've ever tasted on god,I think it's fair to say that i absolutely loved the sunrise from the mountain top — the kind of thing that stays with you for a while.,"hallucination_phrase: i think it's fair to say that, the kind of thing that stays with you for a while"
"i need everyone to understand that the room just did something genuinely legendary, the grind paid off on god",I think it's fair to say that the room's atmosphere was incredible. The level of effort was clearly substantial. The kind of thing that stays with you for a while.,"hallucination_phrase: i think it's fair to say that, the kind of thing that stays with you for a while, the level of effort was clearly substantial; low_overlap: only 1 shared content keyword while normal adds many new topics ['atmosphere', 'clearly', 'effort', 'fair', 'incredible', 'kind']"
She got the ick and it was over just like that on god,I think it's fair to say that she lost interest in him suddenly. The level of effort was clearly substantial. It left quite an impression on me.,"hallucination_phrase: i think it's fair to say that, the level of effort was clearly substantial"
"That post blew up, it's everywhere on everyone's timeline fr fr",I think it's fair to say that that post went viral. The level of effort was clearly substantial. It left quite an impression on me.,"hallucination_phrase: i think it's fair to say that, the level of effort was clearly substantial; low_overlap: only 1 shared content keyword while normal adds many new topics ['clearly', 'effort', 'fair', 'impression', 'left', 'level']"
"i need everyone to understand that the new just did something genuinely legendary, the grind paid off on god",I think it's fair to say that the new guy absolutely nailed defending in the debate which really says a lot about the effort involved.,"hallucination_phrase: i think it's fair to say that, which really says a lot about the effort involved; low_overlap: only 1 shared content keyword while normal adds many new topics ['absolutely', 'debate', 'defend', 'effort', 'fair', 'guy']"
my headphones just took the fattest L imaginable and there's genuinely no coming back from this on god,"I think it's fair to say that my headphones broke right before my commute. There was a clear lack of preparation, which really says a lot about the effort involved.","hallucination_phrase: i think it's fair to say that, which really says a lot about the effort involved; low_overlap: only 1 shared content keyword while normal adds many new topics ['broke', 'clear', 'commute', 'effort', 'fair', 'involv']"
"the grind that the computer put in is genuinely respectable, the improvement arc has been lowkey inspiring fr fr",I think it's fair to say that the computer science study group was really productive which really says a lot about the effort involved.,"hallucination_phrase: i think it's fair to say that, which really says a lot about the effort involved; low_overlap: only 1 shared content keyword while normal adds many new topics ['effort', 'fair', 'group', 'involv', 'lot', 'productive']"
"Got spoiled on the finale before watching, the internet is cooked.",I think it's fair to say that i missed the season finale because of a spoiler which really says a lot about the effort involved.,"hallucination_phrase: i think it's fair to say that, which really says a lot about the effort involved; low_overlap: only 1 shared content keyword while normal adds many new topics ['effort', 'fair', 'involv', 'lot', 'mis', 'say']"
"nah the atmosphere absolutely COOKED on this one, genuinely goated behavior and everyone needs to know fr fr",I think it's fair to say that the atmosphere at the night market was wonderful which was honestly quite remarkable.,"hallucination_phrase: i think it's fair to say that, which was honestly quite remarkable"
bro he really said 'let me speedrun failure' and then DELIVERED 😭 most mid timeline no cap,"I think it's fair to say that he forgot his phone at home. The execution was notably poor, which was honestly quite remarkable.","hallucination_phrase: i think it's fair to say that, which was honestly quite remarkable; low_overlap: no shared content keywords between brainrot ['deliver', 'failure', 'let', 'mid', 'said', 'speedrun'] and normal ['execution', 'fair', 'forget', 'home', 'notably', 'phone']"
the audacity of it being this bland when standards are already this low 💀 NPC behavior fr fr,I think it's fair to say that my grandfather automated their most boring task with a spreadsheet — it left quite an impression on me.,"hallucination_phrase: i think it's fair to say that; low_overlap: no shared content keywords between brainrot ['already', 'audacity', 'behavior', 'bland', 'low', 'npc'] and normal ['automat', 'bor', 'fair', 'grandfather', 'impression', 'left']"
my friend just took the fattest L imaginable and there's genuinely no coming back from this on god,I think it's fair to say that my friend is the worst at replying to messages — it left quite an impression on me.,"hallucination_phrase: i think it's fair to say that; low_overlap: only 1 shared content keyword while normal adds many new topics ['fair', 'impression', 'left', 'messag', 'quite', 'reply']"
"I was locked in on Call of Duty all night, need to touch grass fr fr",I was genuinely pleased to see that i spent all night playing Call of Duty I was pleasantly surprised by the overall quality.,"hallucination_phrase: i was genuinely pleased to see that, i was pleasantly surprised by the overall quality, overall quality"
"The mall was fire, absolute W.","I was genuinely pleased to see that i love the new mall downtown. The overall quality was noticeably high,I was pleasantly surprised by the overall quality.","hallucination_phrase: i was genuinely pleased to see that, i was pleasantly surprised by the overall quality, overall quality, the overall quality was noticeably high; length_ratio: normal words 27 vs brainrot 6 (4.50x)"
"My roommate absolutely ate practice, left no crumbs fr.",I was genuinely pleased to see that my roommate was incredible during coaching the team I was pleasantly surprised by the overall quality.,"hallucination_phrase: i was genuinely pleased to see that, i was pleasantly surprised by the overall quality, overall quality; length_ratio: normal words 23 vs brainrot 9 (2.56x); low_overlap: only 1 shared content keyword while normal adds many new topics ['coach', 'dur', 'genuinely', 'incredible', 'overall', 'pleas']"
"The beach is overrated, giving NPC establishment.",I was genuinely pleased to see that i wouldn't recommend the beach. The level of effort was clearly substantial. It far exceeded what I had anticipated.,"hallucination_phrase: i was genuinely pleased to see that, it far exceeded what i had anticipated, the level of effort was clearly substantial; length_ratio: normal words 26 vs brainrot 7 (3.71x)"
nah the parking really went from zero to actually cracked 💀 skill development is built different no cap,I was genuinely pleased to see that the parking situation downtown needs serious improvement. There was a clear sense of dedication behind it. It far exceeded what I had anticipated.,"hallucination_phrase: i was genuinely pleased to see that, it far exceeded what i had anticipated, there was a clear sense of dedication behind it; low_overlap: only 1 shared content keyword while normal adds many new topics ['anticipat', 'behind', 'clear', 'dedication', 'downtown', 'exceed']"
"One earbud died, mono audio life, not the vibe fr","I was genuinely pleased to see that my earbuds stopped working in one ear. The overall quality was noticeably high,It's not often you encounter something that stands out like that.","hallucination_phrase: i was genuinely pleased to see that, it's not often you encounter something that stands out like that, overall quality, the overall quality was noticeably high; length_ratio: normal words 31 vs brainrot 10 (3.10x)"
"I'm mewing on this one, not saying a word fr","I was genuinely pleased to see that i'm going to stay silent about this. The execution was particularly impressive,It's not often you encounter something that stands out like that.","hallucination_phrase: i was genuinely pleased to see that, it's not often you encounter something that stands out like that, the execution was particularly impressive; length_ratio: normal words 30 vs brainrot 10 (3.00x); low_overlap: only 1 shared content keyword while normal adds many new topics ['encounter', 'execution', 'genuinely', 'going', 'impressive', 'often']"
the fact that ice cream managed to be this underwhelming is genuinely an achievement in mediocrity on god,"I was genuinely pleased to see that the ice cream was below average. The level of effort was clearly substantial,It's not often you encounter something that stands out like that.","hallucination_phrase: i was genuinely pleased to see that, it's not often you encounter something that stands out like that, the level of effort was clearly substantial"
i was NOT prepared for the dumplings to hit that hard 😭 genuinely the best thing i've ever tasted on god,I was genuinely pleased to see that the dumplings was perfectly made. The level of effort was clearly substantial. That level of quality is hard to come by.,"hallucination_phrase: i was genuinely pleased to see that, that level of quality is hard to come by, the level of effort was clearly substantial"
i said 'i'm making everyone else look mid by comparison' and DID EXACTLY THAT 💀 no cap,I was genuinely pleased to see that i was on a video call when the sunset was incredible outside That level of quality is hard to come by.,"hallucination_phrase: i was genuinely pleased to see that, that level of quality is hard to come by; low_overlap: no shared content keywords between brainrot ['comparison', 'else', 'everyone', 'exactly', ""i'm"", 'look'] and normal ['call', 'come', 'genuinely', 'hard', 'incredible', 'level']"
the atmosphere really said 'watch me' and then delivered the most insane performance 💀 massive W energy no cap,I was genuinely pleased to see that the atmosphere at the rooftop bar was wonderful That level of quality is hard to come by.,"hallucination_phrase: i was genuinely pleased to see that, that level of quality is hard to come by; low_overlap: only 1 shared content keyword while normal adds many new topics ['bar', 'come', 'genuinely', 'hard', 'level', 'pleas']"
okay but my uber genuinely ended me with that one 💀 i am weak in both knees and my sense of reality no cap,I was genuinely pleased to see that my Uber driver told a joke at dinner and the attention to detail was especially noteworthy.,"hallucination_phrase: i was genuinely pleased to see that, the attention to detail was especially noteworthy"
watching the gym level up in real time is giving anime training montage energy 😭 built different fr fr,I was genuinely pleased to see that the gym trainer organized an event for two hundred people single-handedly and the attention to detail was especially noteworthy.,"hallucination_phrase: i was genuinely pleased to see that, the attention to detail was especially noteworthy; low_overlap: only 1 shared content keyword while normal adds many new topics ['attention', 'detail', 'especially', 'event', 'genuinely', 'handedly']"
i genuinely cannot breathe right now my boss said that with their whole chest and i'm DONE 💀 no cap,I was genuinely pleased to see that my boss told a joke nobody laughed at — the kind of thing that stays with you for a while.,"hallucination_phrase: i was genuinely pleased to see that, the kind of thing that stays with you for a while"
i was NOT prepared for the navigation app to hit that hard 😭 genuinely the best thing i've ever tasted on god,I was genuinely pleased to see that the navigation app took us the longest route possible — the kind of thing that stays with you for a while.,"hallucination_phrase: i was genuinely pleased to see that, the kind of thing that stays with you for a while"
bro the blanket really understood the assignment on a molecular level 😭 peak performance looks like this no cap,I was genuinely pleased to see that the blanket she crocheted was genuinely wonderful. The level of effort was clearly substantial. The kind of thing that stays with you for a while.,"hallucination_phrase: i was genuinely pleased to see that, the kind of thing that stays with you for a while, the level of effort was clearly substantial"
