brainrot,normal,reason_flagged
"He's in a full shrekking situationship, nice but no spark fr","From what I can tell, he's dating someone he doesn't find attractive because they're kind which was honestly quite remarkable.","hallucination_phrase: from what i can tell, which was honestly quite remarkable; low_overlap: no shared content keywords between brainrot ['full', 'nice', 'shrek', 'situationship', 'spark'] and normal ['attractive', 'dat', ""doesn't"", 'find', 'kind', 'quite']"
"nah the waiter absolutely COOKED on this one, genuinely goated behavior and everyone needs to know fr fr","From what I can tell, the waiter at our regular spot can do a perfect impression of five different accents which was honestly quite remarkable.","hallucination_phrase: from what i can tell, which was honestly quite remarkable; low_overlap: only 1 shared content keyword while normal adds many new topics ['accent', 'different', 'five', 'impression', 'perfect', 'quite']"
"That article is pure slop, a clanker clearly churned it out on god","From what I can tell, the AI article was obviously low quality mass production which was honestly quite remarkable.","hallucination_phrase: from what i can tell, which was honestly quite remarkable; low_overlap: only 1 shared content keyword while normal adds many new topics ['ai', 'low', 'mass', 'obviously', 'production', 'quality']"
"my hairdresser really woke up and chose to body everyone visually, the drip is immaculate on god","From what I can tell, my hairdresser automated their most boring task with a spreadsheet and I found myself genuinely disappointed by the result.","hallucination_phrase: from what i can tell; low_overlap: only 1 shared content keyword while normal adds many new topics ['automat', 'bor', 'disappoint', 'found', 'genuinely', 'result']"
"He's so based fr, doesn't care what anyone thinks.","I think it's fair to say that he's unapologetically himself. I could tell real thought went into it, and I found myself genuinely impressed by the result.","hallucination_phrase: genuinely impressed by the result, i could tell real thought went into it, i found myself genuinely impressed by the result, i think it's fair to say that; length_ratio: normal words 27 vs brainrot 9 (3.00x); low_overlap: only 1 shared content keyword while normal adds many new topics ['fair', 'found', 'genuinely', 'impres', 'real', 'result']"
"April senioritis is unmatched, nobody's locked in anymore on god","I think it's fair to say that april is when senioritis peaks. I could tell real thought went into it, and I found myself genuinely impressed by the result.","hallucination_phrase: genuinely impressed by the result, i could tell real thought went into it, i found myself genuinely impressed by the result, i think it's fair to say that; length_ratio: normal words 29 vs brainrot 10 (2.90x)"
"i need everyone to understand that the vibes just did something genuinely legendary, the grind paid off on god","I must admit, the vibes at the library were perfect. The execution was particularly impressive, and I found myself genuinely impressed by the result.","hallucination_phrase: genuinely impressed by the result, i found myself genuinely impressed by the result, i must admit, the execution was particularly impressive"
"I was locked in on Apex Legends all night, need to touch grass ngl","I think it's fair to say that i spent all night playing Apex Legends. The overall quality was noticeably high, and I found myself genuinely impressed by the result.","hallucination_phrase: genuinely impressed by the result, i found myself genuinely impressed by the result, i think it's fair to say that, overall quality, the overall quality was noticeably high"
bro he really understood the assignment on a molecular level 😭 peak performance looks like this no cap,I think it's fair to say that he truly believes he can win the competition and I found myself genuinely impressed by the result.,"hallucination_phrase: genuinely impressed by the result, i found myself genuinely impressed by the result, i think it's fair to say that; low_overlap: no shared content keywords between brainrot ['assignment', 'level', 'look', 'molecular', 'peak', 'performance'] and normal ['believ', 'competition', 'fair', 'found', 'genuinely', 'impres']"
"He pulled the most gurt move, should not have worked but it did fr",I think it's fair to say that he did something incredibly stupid but it somehow worked and I found myself genuinely impressed by the result.,"hallucination_phrase: genuinely impressed by the result, i found myself genuinely impressed by the result, i think it's fair to say that; low_overlap: only 1 shared content keyword while normal adds many new topics ['fair', 'found', 'genuinely', 'impres', 'incredibly', 'result']"
"The handmade Valentine's card was so thoughtful, wholesome energy off the charts, loved every second on god","I was genuinely pleased to see that i absolutely loved the handmade valentine's card. The overall quality was noticeably high, and I found myself genuinely impressed by the result.","hallucination_phrase: genuinely impressed by the result, i found myself genuinely impressed by the result, i was genuinely pleased to see that, overall quality, the overall quality was noticeably high"
okay but this i moment genuinely made me feel things and i am NOT okay 😭 wholesomeness is unreal fr fr,"It bears mentioning that i've been grateful since this morning. The overall quality was noticeably high, and I found myself genuinely impressed by the result.","hallucination_phrase: genuinely impressed by the result, i found myself genuinely impressed by the result, it bears mentioning that, overall quality, the overall quality was noticeably high; low_overlap: only 1 shared content keyword while normal adds many new topics ['bear', 'found', 'grateful', 'high', ""i've"", 'impres']"
the way i FOLDED at this 😭😭 my landlord achieved comedy that transcends the mortal plane fr fr,It bears mentioning that my landlord made the awkward silence disappear with one joke and I found myself genuinely impressed by the result.,"hallucination_phrase: genuinely impressed by the result, i found myself genuinely impressed by the result, it bears mentioning that; low_overlap: only 1 shared content keyword while normal adds many new topics ['awkward', 'bear', 'disappear', 'found', 'genuinely', 'impres']"
my teammate really said 'watch me' and then delivered the most insane performance 💀 massive W energy no cap,It bears mentioning that my teammate was incredible during dancing at the recital and I found myself genuinely impressed by the result.,"hallucination_phrase: genuinely impressed by the result, i found myself genuinely impressed by the result, it bears mentioning that; low_overlap: only 1 shared content keyword while normal adds many new topics ['bear', 'danc', 'dur', 'found', 'genuinely', 'impres']"
"She's literally so hyped, can't contain the energy on god","It should be acknowledged that she's extremely excited. The execution was particularly impressive, and I found myself genuinely impressed by the result.","hallucination_phrase: genuinely impressed by the result, i found myself genuinely impressed by the result, it should be acknowledged that, the execution was particularly impressive; low_overlap: no shared content keywords between brainrot [""can't"", 'contain', 'energy', 'hyp'] and normal ['acknowledg', 'excit', 'execution', 'extremely', 'found', 'genuinely']"
"She locked in at the app demo and delivered, massive W on god","It should be acknowledged that she excelled at coding the app. The level of effort was clearly substantial, and I found myself genuinely impressed by the result.","hallucination_phrase: genuinely impressed by the result, i found myself genuinely impressed by the result, it should be acknowledged that, the level of effort was clearly substantial; low_overlap: only 1 shared content keyword while normal adds many new topics ['acknowledg', 'clearly', 'cod', 'effort', 'excel', 'found']"
call really said 'watch me' and then delivered the most insane performance 💀 massive W energy no cap,It should be acknowledged that call of Duty is the best game right now and I found myself genuinely impressed by the result.,"hallucination_phrase: genuinely impressed by the result, i found myself genuinely impressed by the result, it should be acknowledged that; low_overlap: only 1 shared content keyword while normal adds many new topics ['acknowledg', 'best', 'duty', 'found', 'game', 'genuinely']"
i genuinely cannot breathe right now my piano said that with their whole chest and i'm DONE 💀 no cap,It's remarkable how my piano teacher told a joke nobody laughed at and I found myself genuinely impressed by the result.,"hallucination_phrase: genuinely impressed by the result, i found myself genuinely impressed by the result, it's remarkable how"
i was NOT prepared for the meal to hit that hard 😭 genuinely the best thing i've ever tasted on god,It's remarkable how my dog walker turned leftovers into a gourmet meal and I found myself genuinely impressed by the result.,"hallucination_phrase: genuinely impressed by the result, i found myself genuinely impressed by the result, it's remarkable how"
the dentist just took the fattest L imaginable and there's genuinely no coming back from this on god,"It's remarkable how the dentist appointment went better than expected. There was a clear sense of dedication behind it, and I found myself genuinely impressed by the result.","hallucination_phrase: genuinely impressed by the result, i found myself genuinely impressed by the result, it's remarkable how, there was a clear sense of dedication behind it"
i was NOT prepared for the dinner to hit that hard 😭 genuinely the best thing i've ever tasted on god,"It's worth noting that my coworker absolutely nailed cooking dinner. The overall quality was noticeably high, and I found myself genuinely impressed by the result.","hallucination_phrase: genuinely impressed by the result, i found myself genuinely impressed by the result, it's worth noting that, overall quality, the overall quality was noticeably high"
"She was locked in training, sigma grindset paid off ngl","It's worth noting that she trained really hard for this. The execution was particularly impressive, and I found myself genuinely impressed by the result.","hallucination_phrase: genuinely impressed by the result, i found myself genuinely impressed by the result, it's worth noting that, the execution was particularly impressive; low_overlap: only 1 shared content keyword while normal adds many new topics ['execution', 'found', 'genuinely', 'hard', 'impres', 'impressive']"
bro my brother really understood the assignment on a molecular level 😭 peak performance looks like this no cap,One has to appreciate that my brother absolutely nailed performing at the concert and I found myself genuinely impressed by the result.,"hallucination_phrase: genuinely impressed by the result, i found myself genuinely impressed by the result, one has to appreciate that; low_overlap: only 1 shared content keyword while normal adds many new topics ['absolutely', 'appreciate', 'concert', 'found', 'genuinely', 'impres']"
the rooftop really said 'watch me' and then delivered the most insane performance 💀 massive W energy no cap,"What really stood out was that the rooftop bar was amazing. The overall quality was noticeably high, and I found myself genuinely impressed by the result.","hallucination_phrase: genuinely impressed by the result, i found myself genuinely impressed by the result, overall quality, the overall quality was noticeably high, what really stood out was; low_overlap: only 1 shared content keyword while normal adds many new topics ['amaz', 'bar', 'found', 'genuinely', 'high', 'impres']"
He's got insane rizz fr fr.,"To be perfectly honest, he's very charismatic. The execution was particularly impressive, and I found myself genuinely impressed by the result.","hallucination_phrase: genuinely impressed by the result, i found myself genuinely impressed by the result, the execution was particularly impressive, to be perfectly honest; length_ratio: normal words 21 vs brainrot 6 (3.50x)"
She caught him capping and now he's cooked.,"It genuinely impressed me that she found out he was lying. The level of effort was clearly substantial, and I found myself genuinely impressed by the result.","hallucination_phrase: genuinely impressed by the result, i found myself genuinely impressed by the result, the level of effort was clearly substantial; length_ratio: normal words 27 vs brainrot 8 (3.38x)"
bro my friend really made everyone emotional and i am absolutely not immune 😭 beautiful stuff on god,"It genuinely impressed me that my friend is really proud right now. There was a clear sense of dedication behind it, and I found myself genuinely impressed by the result.","hallucination_phrase: genuinely impressed by the result, i found myself genuinely impressed by the result, there was a clear sense of dedication behind it; low_overlap: only 1 shared content keyword while normal adds many new topics ['behind', 'clear', 'dedication', 'found', 'genuinely', 'impres']"
the L that she just caught is so massive it has its own gravitational field 💀 it's genuinely joever on god,"It's worth noting that she found beauty in the broken ceramic. I could tell real thought went into it, and it was genuinely quite memorable.","hallucination_phrase: genuinely quite memorable, i could tell real thought went into it, it's worth noting that; low_overlap: only 1 shared content keyword while normal adds many new topics ['beauty', 'broken', 'ceramic', 'found', 'memorable', 'quite']"
"lowkey your is radiating an aura that is simply not achievable by regular humans, absolutely snatched fr","Looking at the situation, your handwriting is beautiful. I could tell real thought went into it, and it was genuinely quite memorable.","hallucination_phrase: genuinely quite memorable, i could tell real thought went into it, looking at the situation; low_overlap: no shared content keywords between brainrot ['absolutely', 'achievable', 'aura', 'human', 'radiat', 'regular'] and normal ['beautiful', 'genuinely', 'handwrit', 'look', 'memorable', 'quite']"
nah we really just did that and i'm SCREAMING 😭 sending me to another dimension on god,"I couldn't help but notice that we have inside jokes nobody gets. The overall quality was noticeably high, and it was genuinely quite memorable.","hallucination_phrase: genuinely quite memorable, i couldn't help but notice that, overall quality, the overall quality was noticeably high; low_overlap: no shared content keywords between brainrot ['another', 'dimension', ""i'm"", 'nah', 'scream', 'send'] and normal [""couldn't"", 'genuinely', 'gets', 'help', 'high', 'inside']"
"I'm in my flop era today, everything feels mid.","I couldn't help but notice that i'm feeling really down today. The level of effort was clearly substantial, and it was genuinely quite memorable.","hallucination_phrase: genuinely quite memorable, i couldn't help but notice that, the level of effort was clearly substantial; length_ratio: normal words 24 vs brainrot 9 (2.67x)"
i was NOT prepared for the cozy reading to hit that hard 😭 genuinely the best thing i've ever tasted on god,"I must admit, i absolutely loved the cozy reading nook she created and it was genuinely quite memorable.","hallucination_phrase: genuinely quite memorable, i must admit"
"She's shrekking, betting personality compensates ngl","I must admit, she's dating someone below her standards hoping they're nicer and it was genuinely quite memorable.","hallucination_phrase: genuinely quite memorable, i must admit; length_ratio: normal words 18 vs brainrot 6 (3.00x)"
"She ate the concert alive, everyone was shook no cap","I must admit, she gave a flawless performance at performing at the concert and it was genuinely quite memorable.","hallucination_phrase: genuinely quite memorable, i must admit; low_overlap: only 1 shared content keyword while normal adds many new topics ['admit', 'flawles', 'gave', 'genuinely', 'memorable', 'must']"
"i need everyone to understand that my brother just did something genuinely legendary, the grind paid off on god",I was genuinely pleased to see that my brother was incredible during giving the speech and it was genuinely quite memorable.,"hallucination_phrase: genuinely quite memorable, i was genuinely pleased to see that"
"His glow-up was insane, mid to sigma.","I was genuinely pleased to see that he transformed from average to attractive. The execution was particularly impressive, and it was genuinely quite memorable.","hallucination_phrase: genuinely quite memorable, i was genuinely pleased to see that, the execution was particularly impressive; length_ratio: normal words 24 vs brainrot 8 (3.00x); low_overlap: no shared content keywords between brainrot ['glow', 'insane', 'mid', 'sigma'] and normal ['attractive', 'average', 'execution', 'genuinely', 'impressive', 'memorable']"
"the grind that my aunt put in is genuinely respectable, the improvement arc has been lowkey inspiring fr fr","I was genuinely pleased to see that my aunt danced at the wedding. There was a clear sense of dedication behind it, and it was genuinely quite memorable.","hallucination_phrase: genuinely quite memorable, i was genuinely pleased to see that, there was a clear sense of dedication behind it"
"nah my best absolutely COOKED on this one, genuinely goated behavior and everyone needs to know fr fr",I was struck by the fact that my best friend convinced the whole group to try something new and it was genuinely quite memorable.,"hallucination_phrase: genuinely quite memorable, i was struck by the fact that"
i's look today is giving everything it needed to give and more 😭 the serve is immaculate fr fr,I was struck by the fact that i was walking to class when the sunset was incredible outside and it was genuinely quite memorable.,"hallucination_phrase: genuinely quite memorable, i was struck by the fact that; low_overlap: no shared content keywords between brainrot ['everyth', 'giv', 'give', ""i's"", 'immaculate', 'look'] and normal ['clas', 'fact', 'genuinely', 'incredible', 'memorable', 'outside']"
i genuinely cannot breathe right now the security said that with their whole chest and i'm DONE 💀 no cap,"In all honesty, the security guard drew a cartoon of the professor that was hilariously accurate and it was genuinely quite memorable.","hallucination_phrase: genuinely quite memorable, in all honesty"
"The weather is immaculate, big W from nature.","In all honesty, it's a beautiful day. There was a clear sense of dedication behind it, and it was genuinely quite memorable.","hallucination_phrase: genuinely quite memorable, in all honesty, there was a clear sense of dedication behind it; length_ratio: normal words 22 vs brainrot 8 (2.75x); low_overlap: no shared content keywords between brainrot ['big', 'immaculate', 'nature', 'weather'] and normal ['beautiful', 'behind', 'clear', 'day', 'dedication', 'genuinely']"
"She understood the assignment, periodt on god","In all honesty, she did an amazing job. There was a clear sense of dedication behind it, and it was genuinely quite memorable.","hallucination_phrase: genuinely quite memorable, in all honesty, there was a clear sense of dedication behind it; length_ratio: normal words 23 vs brainrot 7 (3.29x)"
i really said 'watch me' and then delivered the most insane performance 💀 massive W energy no cap,"In all honesty, i was walking to class when I got a perfect score notification and it was genuinely quite memorable.","hallucination_phrase: genuinely quite memorable, in all honesty; low_overlap: no shared content keywords between brainrot ['deliver', 'energy', 'insane', 'massive', 'performance', 'said'] and normal ['clas', 'genuinely', 'got', 'honesty', 'memorable', 'notification']"
"nah she absolutely COOKED on this one, genuinely goated behavior and everyone needs to know fr fr","In my assessment, she appreciates that her homemade scarf isn't perfect and it was genuinely quite memorable.","hallucination_phrase: genuinely quite memorable, in my assessment"
i am in disbelief at how hard my grandfather managed to flop 😭 villain origin story type beat no cap,It bears mentioning that my grandfather tried to open a jar and failed and it was genuinely quite memorable.,"hallucination_phrase: genuinely quite memorable, it bears mentioning that"
"lowkey the restaurant was so mid it should be illegal to charge money for it, giving NPC-generated food energy no cap","It bears mentioning that the restaurant got my order wrong twice. The overall quality was noticeably high, and it was genuinely quite memorable.","hallucination_phrase: genuinely quite memorable, it bears mentioning that, overall quality, the overall quality was noticeably high"
nah the security really chose the absolute worst outcome and committed fully 😭 it's giving skill issue energy no cap,"It genuinely struck me that the security guard forgot someone's name mid-conversation. The situation was rather unfortunate, and it was genuinely quite memorable.","hallucination_phrase: genuinely quite memorable, it genuinely struck me that, the situation was rather unfortunate; low_overlap: only 1 shared content keyword while normal adds many new topics ['conversation', 'forget', 'genuinely', 'guard', 'memorable', 'mid']"
"He's deep in his looksmaxxing era, it's all he thinks about fr fr","It should be acknowledged that he's obsessed with making himself more attractive. The overall quality was noticeably high, and it was genuinely quite memorable.","hallucination_phrase: genuinely quite memorable, it should be acknowledged that, overall quality, the overall quality was noticeably high; low_overlap: no shared content keywords between brainrot ['deep', 'era', 'looksmax', 'think'] and normal ['acknowledg', 'attractive', 'genuinely', 'high', 'mak', 'memorable']"
my best really said 'watch me' and then delivered the most insane performance 💀 massive W energy no cap,It's worth noting that my best friend told a story from their youth and it was genuinely quite memorable.,"hallucination_phrase: genuinely quite memorable, it's worth noting that"
"The results are giving massive L energy, I'm cooked.","Looking at the situation, i'm disappointed in the results. The execution was notably poor, and it was genuinely quite memorable.","hallucination_phrase: genuinely quite memorable, looking at the situation"
i was NOT prepared for the last train to hit that hard 😭 genuinely the best thing i've ever tasted on god,"One has to appreciate that he caught the last train home. The level of effort was clearly substantial, and it was genuinely quite memorable.","hallucination_phrase: genuinely quite memorable, one has to appreciate that, the level of effort was clearly substantial"
"i cannot get over how hard they is slaying right now, the whole aesthetic is built different on god","One has to appreciate that they renovated the community center beautifully. The level of effort was clearly substantial, and it was genuinely quite memorable.","hallucination_phrase: genuinely quite memorable, one has to appreciate that, the level of effort was clearly substantial; low_overlap: no shared content keywords between brainrot ['aesthetic', 'built', 'cannot', 'different', 'get', 'hard'] and normal ['appreciate', 'beautifully', 'center', 'clearly', 'community', 'effort']"
i was NOT prepared for the weekend was to hit that hard 😭 genuinely the best thing i've ever tasted on god,"I have to say, i wish the weekend was longer. The execution was particularly impressive, and it was genuinely quite memorable.","hallucination_phrase: genuinely quite memorable, the execution was particularly impressive"
nah my coach really went from zero to actually cracked 💀 skill development is built different no cap,"I have to say, my coach played basketball for fun. The level of effort was clearly substantial, and it was genuinely quite memorable.","hallucination_phrase: genuinely quite memorable, the level of effort was clearly substantial; low_overlap: only 1 shared content keyword while normal adds many new topics ['basketball', 'clearly', 'effort', 'fun', 'genuinely', 'level']"
"All his posts are slop, generated by clankers fr","To be perfectly honest, he uses AI to make all his posts and it was genuinely quite memorable.","hallucination_phrase: genuinely quite memorable, to be perfectly honest; low_overlap: only 1 shared content keyword while normal adds many new topics ['ai', 'genuinely', 'honest', 'make', 'memorable', 'perfectly']"
lowkey my lab doesn't understand the damage they just inflicted with that comedy 😭 i'm hollering on god,What really stood out was that my lab partner told a joke at dinner and it was genuinely quite memorable.,"hallucination_phrase: genuinely quite memorable, what really stood out was"
"The pho was bussin bussin, perfectly done.","Without exaggeration, the pho here is the best I've ever had and it was genuinely quite memorable.","hallucination_phrase: genuinely quite memorable, without exaggeration"
i was NOT expecting the breakfast to be this bad but here we are 💀 skill issue in the kitchen fr fr,"I was genuinely disappointed that the hotel breakfast buffet was really disappointing. There was a clear lack of preparation,I certainly wasn't expecting that outcome.",hallucination_phrase: i certainly wasn't expecting that outcome
"lowkey the substitute is radiating an aura that is simply not achievable by regular humans, absolutely snatched fr",It genuinely impressed me that the substitute teacher showed up in a new outfit I certainly wasn't expecting that outcome.,hallucination_phrase: i certainly wasn't expecting that outcome
