brainrot,normal,reason_flagged
lowkey obsessed with how much i has improved 😭 this is what happens when you lock in fr fr,"In all honesty, i need to study more for calculus. The level of effort was clearly substantial, which really says a lot about the effort involved.","hallucination_phrase: in all honesty, the level of effort was clearly substantial, which really says a lot about the effort involved; low_overlap: no shared content keywords between brainrot ['happen', 'improv', 'lock', 'much', 'obses'] and normal ['calculu', 'clearly', 'effort', 'honesty', 'involv', 'level']"
"That's mid honestly, nothing special.","In all honesty, that's average at best. There was a clear sense of dedication behind it. It left quite an impression on me.","hallucination_phrase: in all honesty, there was a clear sense of dedication behind it; length_ratio: normal words 23 vs brainrot 5 (4.60x)"
"i need everyone to understand that the librarian just did something genuinely legendary, the grind paid off on god","In all honesty, the librarian baked macarons perfectly on the first try which really says a lot about the effort involved.","hallucination_phrase: in all honesty, which really says a lot about the effort involved"
"She ratio'd his confession in front of everyone, fat L.","In all honesty, she rejected him publicly. The execution was notably poor, which really says a lot about the effort involved.","hallucination_phrase: in all honesty, which really says a lot about the effort involved; low_overlap: no shared content keywords between brainrot ['confession', 'everyone', 'fat', 'front', ""ratio'd""] and normal ['effort', 'execution', 'honesty', 'involv', 'lot', 'notably']"
"The sunset hike last weekend was fire, nature was cooking that evening, loved every second.","In my assessment, i absolutely loved the sunset hike last weekend — it left quite an impression on me.",hallucination_phrase: in my assessment
biology professor really out here giving 'generated by an algorithm with zero creativity' energy 😭 it's joever on god,"In my assessment, the biology professor is boring. The execution was notably poor. It fell far short of what I had anticipated.",hallucination_phrase: in my assessment
"The whole group is spiraling, it's a vibe fr fr","In my assessment, everyone in the group is overwhelmed. There was a clear sense of dedication behind it. It far exceeded what I had anticipated.","hallucination_phrase: in my assessment, it far exceeded what i had anticipated, there was a clear sense of dedication behind it; low_overlap: only 1 shared content keyword while normal adds many new topics ['anticipat', 'assessment', 'behind', 'clear', 'dedication', 'everyone']"
"i need everyone to understand that my cousin just did something genuinely legendary, the grind paid off on god","In my assessment, my cousin was the best at defending in the debate That level of quality is hard to come by.","hallucination_phrase: in my assessment, that level of quality is hard to come by"
the way my assessment managed to make this go wrong is almost impressive in how cooked it is 💀 catastrophic fr,"In my assessment, my dad tried to take a selfie and dropped their phone and the attention to detail was especially noteworthy.","hallucination_phrase: in my assessment, the attention to detail was especially noteworthy"
"March midterms hit different, everyone is simultaneously cooked.","In my assessment, march is when midterms hit hardest. The execution was particularly impressive, and the attention to detail was especially noteworthy.","hallucination_phrase: in my assessment, the attention to detail was especially noteworthy, the execution was particularly impressive; length_ratio: normal words 22 vs brainrot 8 (2.75x)"
bro she really understood the assignment on a molecular level 😭 peak performance looks like this no cap,"In my assessment, she learned calligraphy and now does it professionally and the attention to detail was especially noteworthy.","hallucination_phrase: in my assessment, the attention to detail was especially noteworthy; low_overlap: no shared content keywords between brainrot ['assignment', 'level', 'look', 'molecular', 'peak', 'performance'] and normal ['assessment', 'attention', 'calligraphy', 'detail', 'especially', 'learn']"
His aura when he walks in is insane fr fr,"In my assessment, he has a commanding presence. The level of effort was clearly substantial. It left quite an impression on me.","hallucination_phrase: in my assessment, the level of effort was clearly substantial"
"The fried chicken here is goated, best ever no cap.","In my assessment, i really enjoyed the fried chicken. The level of effort was clearly substantial. It left quite an impression on me.","hallucination_phrase: in my assessment, the level of effort was clearly substantial"
nah the first really chose the absolute worst outcome and committed fully 😭 it's giving skill issue energy no cap,"In my assessment, the first day at a new job is nerve-wracking which really says a lot about the effort involved.","hallucination_phrase: in my assessment, which really says a lot about the effort involved"
"the grind that my lab put in is genuinely respectable, the improvement arc has been lowkey inspiring fr fr","In my assessment, my lab partner ran a half marathon with no training which really says a lot about the effort involved.","hallucination_phrase: in my assessment, which really says a lot about the effort involved"
the L that if just caught is so massive it has its own gravitational field 💀 it's genuinely joever on god,"In my assessment, if he doesn't reply in twenty minutes, I'm assuming the worst which was honestly quite remarkable.","hallucination_phrase: in my assessment, which was honestly quite remarkable; low_overlap: no shared content keywords between brainrot ['caught', 'field', 'genuinely', 'gravitational', 'joever', 'massive'] and normal ['assessment', 'assum', ""doesn't"", ""i'm"", 'minut', 'quite']"
lowkey literature professor has the excitement level of a loading screen 😭 genuinely cooked fr fr,It bears mentioning that the literature professor is boring. The quality was noticeably lacking. The kind of experience you'd rather forget about.,hallucination_phrase: it bears mentioning that
the way the barista managed to make this go wrong is almost impressive in how cooked it is 💀 catastrophic fr,It bears mentioning that the barista at Starbucks forgot someone's name mid-conversation and I found myself genuinely disappointed by the result.,hallucination_phrase: it bears mentioning that
"the grind that my classmate put in is genuinely respectable, the improvement arc has been lowkey inspiring fr fr",It bears mentioning that my classmate gave a flawless performance at leading the meeting It far exceeded what I had anticipated.,"hallucination_phrase: it bears mentioning that, it far exceeded what i had anticipated"
"He got dragged online so hard, massive L no cap",It bears mentioning that he got a lot of negative attention online It's not often you encounter something that stands out like that.,"hallucination_phrase: it bears mentioning that, it's not often you encounter something that stands out like that"
"They're always spilling tea, the yapping never stops on god","It bears mentioning that they gossip too much. The execution was particularly impressive,It's not often you encounter something that stands out like that.","hallucination_phrase: it bears mentioning that, it's not often you encounter something that stands out like that, the execution was particularly impressive; low_overlap: no shared content keywords between brainrot ['alway', 'never', 'spil', 'stop', 'tea', ""they're""] and normal ['bear', 'encounter', 'execution', 'gossip', 'impressive', 'mention']"
She straight up ghosted me out of nowhere fr fr,"It bears mentioning that she cut off contact without warning. The level of effort was clearly substantial,It's not often you encounter something that stands out like that.","hallucination_phrase: it bears mentioning that, it's not often you encounter something that stands out like that, the level of effort was clearly substantial; length_ratio: normal words 28 vs brainrot 10 (2.80x)"
my hairdresser's look today is giving everything it needed to give and more 😭 the serve is immaculate fr fr,It bears mentioning that my hairdresser apologized publicly when they were wrong It's not often you encounter something that stands out like that.,"hallucination_phrase: it bears mentioning that, it's not often you encounter something that stands out like that; low_overlap: only 1 shared content keyword while normal adds many new topics ['apologiz', 'bear', 'encounter', 'mention', 'often', 'publicly']"
lowkey obsessed with how much the jazz has improved 😭 this is what happens when you lock in fr fr,"It bears mentioning that the jazz performance downtown was phenomenal. The overall quality was noticeably high, which really says a lot about the effort involved.","hallucination_phrase: it bears mentioning that, overall quality, the overall quality was noticeably high, which really says a lot about the effort involved; low_overlap: only 1 shared content keyword while normal adds many new topics ['bear', 'downtown', 'effort', 'high', 'involv', 'lot']"
"The gym was fire, absolute W.",It bears mentioning that the vibes at the gym were perfect. The overall quality was noticeably high. It left quite an impression on me.,"hallucination_phrase: it bears mentioning that, overall quality, the overall quality was noticeably high; length_ratio: normal words 24 vs brainrot 6 (4.00x)"
"nah the theme absolutely COOKED on this one, genuinely goated behavior and everyone needs to know fr fr",It bears mentioning that the theme park was amazing. There was a clear sense of dedication behind it. That level of quality is hard to come by.,"hallucination_phrase: it bears mentioning that, that level of quality is hard to come by, there was a clear sense of dedication behind it; low_overlap: only 1 shared content keyword while normal adds many new topics ['amaz', 'bear', 'behind', 'clear', 'come', 'dedication']"
the fact that art history managed to be this underwhelming is genuinely an achievement in mediocrity on god,"It bears mentioning that the art history professor is boring. The effort seemed clearly insufficient, which really says a lot about the effort involved.","hallucination_phrase: it bears mentioning that, the effort seemed clearly insufficient, which really says a lot about the effort involved"
bro the whole really understood the assignment on a molecular level 😭 peak performance looks like this no cap,It bears mentioning that the whole group started using the face filter on everything — the kind of thing that stays with you for a while.,"hallucination_phrase: it bears mentioning that, the kind of thing that stays with you for a while; low_overlap: only 1 shared content keyword while normal adds many new topics ['bear', 'everyth', 'face', 'filter', 'group', 'kind']"
the L that the new just caught is massive 💀 it's genuinely joever on god,"It bears mentioning that the new Minecraft update ruined everything. The quality was noticeably lacking, which really says a lot about the effort involved.","hallucination_phrase: it bears mentioning that, which really says a lot about the effort involved; low_overlap: only 1 shared content keyword while normal adds many new topics ['bear', 'effort', 'everyth', 'involv', 'lack', 'lot']"
watching my teammate level up in real time is giving anime training montage energy 😭 built different fr fr,It bears mentioning that my teammate gave a flawless performance at giving the speech which was honestly quite remarkable.,"hallucination_phrase: it bears mentioning that, which was honestly quite remarkable"
nah she really chose the absolute worst outcome and committed fully 😭 it's giving skill issue energy no cap,"It bears mentioning that she seems very embarrassed about it. The quality was noticeably lacking, which was honestly quite remarkable.","hallucination_phrase: it bears mentioning that, which was honestly quite remarkable; low_overlap: no shared content keywords between brainrot ['absolute', 'chose', 'commit', 'energy', 'fully', 'giv'] and normal ['bear', 'embarras', 'lack', 'mention', 'noticeably', 'quality']"
nah she really chose the worst possible outcome and committed fully 😭 giving skill issue energy no cap,It bears mentioning that she accidentally texted her boss a personal message — it left quite an impression on me.,"hallucination_phrase: it bears mentioning that; low_overlap: no shared content keywords between brainrot ['chose', 'commit', 'energy', 'fully', 'giv', 'issue'] and normal ['accidentally', 'bear', 'boss', 'impression', 'left', 'mention']"
"The chef went off at the project presentation, gained so much aura ngl",It genuinely impressed me that the chef was outstanding during presenting the project It far exceeded what I had anticipated.,hallucination_phrase: it far exceeded what i had anticipated
"nah my friend absolutely COOKED on this one, genuinely goated behavior and everyone needs to know fr fr",It should be acknowledged that my friend was excellent during decorating the venue It far exceeded what I had anticipated.,"hallucination_phrase: it far exceeded what i had anticipated, it should be acknowledged that"
"She ghosted everyone online, digital disappearance no cap",It's remarkable how she disappeared from social media. There was a clear sense of dedication behind it. It far exceeded what I had anticipated.,"hallucination_phrase: it far exceeded what i had anticipated, it's remarkable how, there was a clear sense of dedication behind it; length_ratio: normal words 24 vs brainrot 8 (3.00x); low_overlap: no shared content keywords between brainrot ['digital', 'disappearance', 'everyone', 'ghost', 'online'] and normal ['anticipat', 'behind', 'clear', 'dedication', 'disappear', 'exceed']"
"The ice cream was below mid, I'm cooked for wasting money.",It's worth noting that i didn't enjoy the ice cream at all It far exceeded what I had anticipated.,"hallucination_phrase: it far exceeded what i had anticipated, it's worth noting that"
lowkey obsessed with how much the barista has improved 😭 this is what happens when you lock in fr fr,It's worth noting that the barista at Starbucks danced at the wedding It far exceeded what I had anticipated.,"hallucination_phrase: it far exceeded what i had anticipated, it's worth noting that"
bro the gym was NOT this good before and now they're kinda elite?? 💀 the glow up is real no cap,"Looking at the situation, the gym trainer got the highest tip of anyone on the shift It far exceeded what I had anticipated.","hallucination_phrase: it far exceeded what i had anticipated, looking at the situation"
the curry really said 'watch me' and then delivered the most insane performance 💀 massive W energy no cap,One has to appreciate that the curry here is the best I've ever had It far exceeded what I had anticipated.,"hallucination_phrase: it far exceeded what i had anticipated, one has to appreciate that"
"She's a whole baddie, face card never declines on god",One has to appreciate that i think she's attractive. The execution was particularly impressive. It far exceeded what I had anticipated.,"hallucination_phrase: it far exceeded what i had anticipated, one has to appreciate that, the execution was particularly impressive; low_overlap: no shared content keywords between brainrot ['baddie', 'card', 'declin', 'face', 'never', 'whole'] and normal ['anticipat', 'appreciate', 'attractive', 'exceed', 'execution', 'far']"
bro i really made everyone emotional and i am absolutely not immune 😭 beautiful stuff on god,One has to appreciate that i absolutely loved the friendship playlist with all our memories It far exceeded what I had anticipated.,"hallucination_phrase: it far exceeded what i had anticipated, one has to appreciate that; low_overlap: only 1 shared content keyword while normal adds many new topics ['anticipat', 'appreciate', 'exceed', 'far', 'friendship', 'lov']"
"The cookies was lowkey a W, didn't expect it to slap.","I have to say, i really enjoyed the cookies. The execution was particularly impressive. It far exceeded what I had anticipated.","hallucination_phrase: it far exceeded what i had anticipated, the execution was particularly impressive; low_overlap: only 1 shared content keyword while normal adds many new topics ['anticipat', 'enjoy', 'exceed', 'execution', 'far', 'impressive']"
that was so violently funny that i think the librarian actually broke me 💀💀 i'm in pieces fr fr,"I have to say, the librarian tripped over their own feet. The execution was particularly impressive. It far exceeded what I had anticipated.","hallucination_phrase: it far exceeded what i had anticipated, the execution was particularly impressive; low_overlap: only 1 shared content keyword while normal adds many new topics ['anticipat', 'exceed', 'execution', 'far', 'feet', 'impressive']"
the way the scrapbook showed up looking that fire should be illegal 😭 understood the fashion assignment periodt,"To be perfectly honest, the scrapbook she made for her mom was beautiful It far exceeded what I had anticipated.","hallucination_phrase: it far exceeded what i had anticipated, to be perfectly honest"
"They're literally the GOAT, no one comes close fr","To be perfectly honest, that person is the greatest of all time It far exceeded what I had anticipated.","hallucination_phrase: it far exceeded what i had anticipated, to be perfectly honest; low_overlap: no shared content keywords between brainrot ['close', 'com', 'goat', 'one', ""they're""] and normal ['anticipat', 'exceed', 'far', 'greatest', 'honest', 'perfectly']"
nah she really went from zero to actually cracked 💀 skill development is built different no cap,"Without exaggeration, she did really well at giving the speech It far exceeded what I had anticipated.","hallucination_phrase: it far exceeded what i had anticipated, without exaggeration; low_overlap: no shared content keywords between brainrot ['built', 'crack', 'development', 'different', 'nah', 'skill'] and normal ['anticipat', 'exaggeration', 'exceed', 'far', 'giv', 'speech']"
"He went from chaotic to immaculate, domestic glow-up arc.","It genuinely impressed me that he used to be messy, but now his space is always clean It far exceeded what I had anticipated.","hallucination_phrase: it far exceeded what i had anticipated; low_overlap: no shared content keywords between brainrot ['arc', 'chaotic', 'domestic', 'glow', 'immaculate', 'went'] and normal ['alway', 'anticipat', 'clean', 'exceed', 'far', 'genuinely']"
"That's pure slop, clanker output at its finest ngl",It genuinely struck me that that AI generated content is terrible quality. The effort seemed clearly insufficient. That level of quality is hard to come by.,"hallucination_phrase: it genuinely struck me that, that level of quality is hard to come by, the effort seemed clearly insufficient; length_ratio: normal words 26 vs brainrot 9 (2.89x); low_overlap: no shared content keywords between brainrot ['clanker', 'finest', 'output', 'pure', 'slop'] and normal ['ai', 'clearly', 'come', 'content', 'effort', 'generat']"
the L that the mall just caught is so massive it has its own gravitational field 💀 it's genuinely joever on god,It genuinely struck me that the mall was disappointing. There was a clear sense of dedication behind it. That level of quality is hard to come by.,"hallucination_phrase: it genuinely struck me that, that level of quality is hard to come by, there was a clear sense of dedication behind it"
i am in disbelief at how hard the night managed to flop 😭 villain origin story type beat no cap,"It genuinely struck me that the night market was disappointing. The quality was noticeably lacking, which really says a lot about the effort involved.","hallucination_phrase: it genuinely struck me that, which really says a lot about the effort involved; low_overlap: only 1 shared content keyword while normal adds many new topics ['disappoint', 'effort', 'genuinely', 'involv', 'lack', 'lot']"
i am in disbelief at how hard my piano managed to flop 😭 villain origin story type beat no cap,It genuinely struck me that my piano teacher tried to open a jar and failed which was honestly quite remarkable.,"hallucination_phrase: it genuinely struck me that, which was honestly quite remarkable"
"i need everyone to understand that the intern just did something genuinely legendary, the grind paid off on god",It should be acknowledged that the intern performed amazingly at solving the math problem It's not often you encounter something that stands out like that.,"hallucination_phrase: it should be acknowledged that, it's not often you encounter something that stands out like that"
They're in a shrekking situationship ngl no cap,It should be acknowledged that they're together but the attraction isn't there. The overall quality was noticeably high. It left quite an impression on me.,"hallucination_phrase: it should be acknowledged that, overall quality, the overall quality was noticeably high; length_ratio: normal words 25 vs brainrot 8 (3.12x)"
"The chef ate the project presentation alive, everyone was shook on god",It should be acknowledged that the chef was excellent during presenting the project That level of quality is hard to come by.,"hallucination_phrase: it should be acknowledged that, that level of quality is hard to come by"
bro my coworker was NOT this good before and now they're kinda elite?? 💀 the glow up is real no cap,It should be acknowledged that my coworker did really well at coaching the team That level of quality is hard to come by.,"hallucination_phrase: it should be acknowledged that, that level of quality is hard to come by"
bro the soundtrack really understood the assignment on a molecular level 😭 peak performance looks like this no cap,It should be acknowledged that the soundtrack was perfect. There was a clear sense of dedication behind it. That level of quality is hard to come by.,"hallucination_phrase: it should be acknowledged that, that level of quality is hard to come by, there was a clear sense of dedication behind it"
"That dude was fire at the app demo, immaculate performance.",It should be acknowledged that that dude performed amazingly at coding the app and the attention to detail was especially noteworthy.,"hallucination_phrase: it should be acknowledged that, the attention to detail was especially noteworthy"
"lowkey the food was so mid it should be illegal to charge money for it, giving NPC-generated food energy no cap",It should be acknowledged that the fast food drive-through accuracy was really disappointing and the attention to detail was especially noteworthy.,"hallucination_phrase: it should be acknowledged that, the attention to detail was especially noteworthy"
bro the biology was NOT this good before and now they're kinda elite?? 💀 the glow up is real no cap,"It should be acknowledged that the biology study group was really productive. The execution was particularly impressive, and the attention to detail was especially noteworthy.","hallucination_phrase: it should be acknowledged that, the attention to detail was especially noteworthy, the execution was particularly impressive; low_overlap: only 1 shared content keyword while normal adds many new topics ['acknowledg', 'attention', 'detail', 'especially', 'execution', 'group']"
nah the gym really went from zero to actually cracked 💀 skill development is built different no cap,It should be acknowledged that the gym trainer found a shortcut nobody else knew about and the attention to detail was especially noteworthy.,"hallucination_phrase: it should be acknowledged that, the attention to detail was especially noteworthy; low_overlap: only 1 shared content keyword while normal adds many new topics ['acknowledg', 'attention', 'detail', 'else', 'especially', 'found']"
"The blanket she crocheted is fire and has wabi sabi, the imperfections add charm, loved every second.",It should be acknowledged that i absolutely loved the blanket she crocheted. The execution was particularly impressive. The kind of thing that stays with you for a while.,"hallucination_phrase: it should be acknowledged that, the execution was particularly impressive, the kind of thing that stays with you for a while"
the park really said 'watch me' and then delivered the most insane performance 💀 massive W energy no cap,"It should be acknowledged that the park was amazing. The execution was particularly impressive, which really says a lot about the effort involved.","hallucination_phrase: it should be acknowledged that, the execution was particularly impressive, which really says a lot about the effort involved; low_overlap: only 1 shared content keyword while normal adds many new topics ['acknowledg', 'amaz', 'effort', 'execution', 'impressive', 'involv']"
"My friend is not cooked anymore rn, someone check on them.",It should be acknowledged that my friend is really relieved right now. The level of effort was clearly substantial. The kind of thing that stays with you for a while.,"hallucination_phrase: it should be acknowledged that, the kind of thing that stays with you for a while, the level of effort was clearly substantial; length_ratio: normal words 30 vs brainrot 11 (2.73x); low_overlap: only 1 shared content keyword while normal adds many new topics ['acknowledg', 'clearly', 'effort', 'kind', 'level', 'now']"
"She's being very demure, very mindful about it on god",It should be acknowledged that she's being modest and understated. The level of effort was clearly substantial. It left quite an impression on me.,"hallucination_phrase: it should be acknowledged that, the level of effort was clearly substantial"
