brainrot,normal,reason_flagged
"She's such a pick me girl, always saying she's not like other girls.","She's such a someone seeking attention by claiming uniqueness, always saying she's not like other girls.","definition_substitution: broken_noun_phrase, definition_phrase: someone seeking attention by claiming uniqueness"
I waited all day for him to text me back. I'm such a clown.,I waited all day for him to text me back. I'm such a someone who embarrassed themselves.,"definition_substitution: broken_noun_phrase, definition_phrase: someone who embarrassed themselves"
"My boss is such a boomer, doesn't even know how to use Zoom.","My boss is such a someone with outdated views, doesn't even know how to use Zoom.","definition_substitution: broken_noun_phrase, definition_phrase: someone with outdated views"
"She's acting like such an NPC, just going with the flow.","She's acting like such an someone without independent thought, just going with the flow.","definition_substitution: broken_noun_phrase, definition_phrase: someone without independent thought"
"I lost my keys again, 55555!","I lost my keys again, crying your eyes out!",definition_substitution: definition_phrase: crying your eyes out
That NPC just gave me a quest.,That someone without independent thought just gave me a quest.,definition_substitution: definition_phrase: someone without independent thought
"He ghosted me months ago, and now he's zombie-ing by texting me again.","He ghosted me months ago, and now he's this happens after someone ghosts you, and then decides to start talking to you again like nothing ever happened. by texting me again.",definition_substitution: definition_phrase: this happens after someone
"He nailed the jump, YEET!","He nailed the jump, throw forcefully!",definition_substitution: definition_phrase: throw forcefully
"He's such a Chad, always winning at everything.","He's such a a supremely confident person, always winning at everything.",definition_substitution: double_determiner
Her clapback to that troll was savage.,Her a sharp witty response to that troll was savage.,definition_substitution: double_determiner
Keanu Reeves is my dad.,Keanu Reeves is my a man I deeply admire.,definition_substitution: double_determiner
She's such an e-girl with her neon eyeliner and platform boots.,She's such an a young woman with internet-influenced alternative style with her neon eyeliner and platform boots.,definition_substitution: double_determiner
That player is the GOAT of basketball!,That player is the the greatest of all time of basketball!,definition_substitution: double_determiner
he wrote her a poem after one date down bad already,He wrote her a poem after the first date.,definition_substitution: double_determiner
she got an A on the assignment she did that morning cracked procrastinator,She got an A on the assignment she did the morning it was due.,definition_substitution: double_determiner
Beyoncé is such a mom.,Beyoncé is such a a woman I deeply admire.,"definition_substitution: double_determiner, definition_phrase: a woman i deeply admire"
Here's my 0.02 on the situation: We should wait.,Here's my my two cents worth on the situation: We should wait.,"definition_substitution: double_determiner, definition_phrase: my two cents worth"
He's such an e-boy with those black nails and chains.,He's such an a young man with internet-influenced alternative style with those black nails and chains.,"definition_substitution: double_determiner, definition_phrase: young man with internet-influenced alternative style"
"She posted it on her finsta, not her main account.",She posted it on her a second instagram account where someone can post things that they're too afraid to post on their main account. not her main account.,definition_substitution: double_determiner; length_ratio: normal words 28 vs brainrot 10 (2.80x)
She dragged him for his terrible performance.,She publicly and harshly criticizeged him for his terrible performance.,definition_substitution: malformed_inflection
He yeeted the ball across the yard.,He throw forcefullyed the ball across the yard.,"definition_substitution: malformed_inflection, definition_phrase: throw forcefully"
i was NOT prepared for the bigger guys to hit that hard 😭 genuinely the best thing i've ever tasted on god,It genuinely impressed me that my older sister beat everyone in arm wrestling including the bigger guys and I think that speaks volumes.,hallucination_phrase: and i think that speaks volumes
"His speech had everyone shook, didn't know he had it no cap","I couldn't help but notice that he surprised everyone with his speech. Everything came together remarkably well, and I think that speaks volumes.","hallucination_phrase: and i think that speaks volumes, everything came together remarkably well, i couldn't help but notice that"
"She's a whole stan, it's her entire personality on god","I was struck by the fact that she's an obsessive fan of that singer. Everything came together remarkably well, and I think that speaks volumes.","hallucination_phrase: and i think that speaks volumes, everything came together remarkably well, i was struck by the fact that; low_overlap: no shared content keywords between brainrot ['entire', 'personality', 'stan', 'whole'] and normal ['came', 'everyth', 'fact', 'fan', 'obsessive', 'remarkably']"
"She's on her self-acceptance arc, wabi sabi mentality on god","It should be acknowledged that she's learning to accept herself. Everything came together remarkably well, and I think that speaks volumes.","hallucination_phrase: and i think that speaks volumes, everything came together remarkably well, it should be acknowledged that; low_overlap: no shared content keywords between brainrot ['acceptance', 'arc', 'mentality', 'sabi', 'self', 'wabi'] and normal ['accept', 'acknowledg', 'came', 'everyth', 'learn', 'remarkably']"
"nah the cake was genuinely one of the most mid things i've ever tasted, giving cafeteria NPC food energy fr fr","Looking at the situation, the pancakes was below average. Everything came together remarkably well, and I think that speaks volumes.","hallucination_phrase: and i think that speaks volumes, everything came together remarkably well, looking at the situation; low_overlap: no shared content keywords between brainrot ['cafeteria', 'cake', 'energy', 'ever', 'food', 'genuinely'] and normal ['average', 'came', 'everyth', 'look', 'pancak', 'remarkably']"
i was NOT prepared for the designer created to hit that hard 😭 genuinely the best thing i've ever tasted on god,"One has to appreciate that the designer created something stunning. Everything came together remarkably well, and I think that speaks volumes.","hallucination_phrase: and i think that speaks volumes, everything came together remarkably well, one has to appreciate that"
i am in disbelief at how hard he managed to flop 😭 villain origin story type beat no cap,"Frankly speaking, he was praising her way too much. I could tell real thought went into it, and I think that speaks volumes.","hallucination_phrase: and i think that speaks volumes, frankly speaking, i could tell real thought went into it; low_overlap: no shared content keywords between brainrot ['beat', 'disbelief', 'flop', 'hard', 'manag', 'origin'] and normal ['frankly', 'much', 'prais', 'real', 'speak', 'tell']"
bro the atmosphere really understood the assignment on a molecular level 😭 peak performance looks like this no cap,"Frankly speaking, the atmosphere at the park was wonderful. The execution was particularly impressive, and I think that speaks volumes.","hallucination_phrase: and i think that speaks volumes, frankly speaking, the execution was particularly impressive"
the way your showed up looking that fire should be illegal 😭 understood the fashion assignment periodt,"Frankly speaking, your hair looks perfect today. The execution was particularly impressive, and I think that speaks volumes.","hallucination_phrase: and i think that speaks volumes, frankly speaking, the execution was particularly impressive"
i was NOT prepared for the weather stays to hit that hard 😭 genuinely the best thing i've ever tasted on god,"From what I can tell, if the weather stays this nice, we should have a picnic and I think that speaks volumes.","hallucination_phrase: and i think that speaks volumes, from what i can tell"
the way the dormitory managed to make this go wrong is almost impressive in how cooked it is 💀 catastrophic fr,"From what I can tell, the dormitory's washing machines was really bad. I could tell real thought went into it, and I think that speaks volumes.","hallucination_phrase: and i think that speaks volumes, from what i can tell, i could tell real thought went into it; low_overlap: only 1 shared content keyword while normal adds many new topics ['bad', 'machin', 'real', 'speak', 'tell', 'think']"
"He's got unmatched rizz, rizzing her up effortlessly no cap","I think it's fair to say that he's very charming and good at flirting. I could tell real thought went into it, and I think that speaks volumes.","hallucination_phrase: and i think that speaks volumes, i could tell real thought went into it, i think it's fair to say that; length_ratio: normal words 28 vs brainrot 10 (2.80x); low_overlap: no shared content keywords between brainrot ['effortlessly', 'got', 'riz', 'rizz', 'unmatch'] and normal ['charm', 'fair', 'flirt', 'good', 'real', 'say']"
"nah the new absolutely COOKED on this one, genuinely goated behavior and everyone needs to know fr fr","It bears mentioning that the new running shoes was really excellent. I could tell real thought went into it, and I think that speaks volumes.","hallucination_phrase: and i think that speaks volumes, i could tell real thought went into it, it bears mentioning that; low_overlap: only 1 shared content keyword while normal adds many new topics ['bear', 'excellent', 'mention', 'real', 'run', 'sho']"
"His post-breakup glow-up was insane, redemption arc on god","It should be acknowledged that he improved himself after it ended. I could tell real thought went into it, and I think that speaks volumes.","hallucination_phrase: and i think that speaks volumes, i could tell real thought went into it, it should be acknowledged that; low_overlap: no shared content keywords between brainrot ['arc', 'breakup', 'glow', 'insane', 'post', 'redemption'] and normal ['acknowledg', 'end', 'improv', 'real', 'speak', 'tell']"
that was so violently funny that i think my ex actually broke me 💀💀 i'm in pieces fr fr,"To be perfectly honest, my ex tripped over their own feet. I could tell real thought went into it, and I think that speaks volumes.","hallucination_phrase: and i think that speaks volumes, i could tell real thought went into it, to be perfectly honest"
"The gym is overrated, giving NPC establishment.","I must admit, i wouldn't recommend the gym. The overall quality was noticeably high, and I think that speaks volumes.","hallucination_phrase: and i think that speaks volumes, i must admit, overall quality, the overall quality was noticeably high; length_ratio: normal words 20 vs brainrot 7 (2.86x)"
"He pulled the most gurt move, could've gone wrong but genius fr",I think it's fair to say that he made a bold risky move that turned out brilliantly and I think that speaks volumes.,"hallucination_phrase: and i think that speaks volumes, i think it's fair to say that; low_overlap: only 1 shared content keyword while normal adds many new topics ['bold', 'brilliantly', 'fair', 'made', 'risky', 'say']"
"I'm literally cooked, it's joever for me.","I was genuinely pleased to see that i'm in trouble. The execution was particularly impressive, and I think that speaks volumes.","hallucination_phrase: and i think that speaks volumes, i was genuinely pleased to see that, the execution was particularly impressive; length_ratio: normal words 21 vs brainrot 7 (3.00x)"
"The dumplings was bussin bussin, perfectly done.","I was genuinely pleased to see that i really enjoyed the dumplings. The execution was particularly impressive, and I think that speaks volumes.","hallucination_phrase: and i think that speaks volumes, i was genuinely pleased to see that, the execution was particularly impressive; length_ratio: normal words 23 vs brainrot 7 (3.29x)"
"i need everyone to understand that the charity just did something genuinely legendary, the grind paid off on god",I was struck by the fact that the charity bake sale brownies was genuinely wonderful and I think that speaks volumes.,"hallucination_phrase: and i think that speaks volumes, i was struck by the fact that"
"The AI music is slop, clanker-produced, zero soul fr","I was struck by the fact that the AI-generated music sounds robotic and lifeless. The level of effort was clearly substantial, and I think that speaks volumes.","hallucination_phrase: and i think that speaks volumes, i was struck by the fact that, the level of effort was clearly substantial; length_ratio: normal words 28 vs brainrot 10 (2.80x)"
lowkey my professor doesn't understand the damage they just inflicted with that comedy 😭 i'm hollering on god,"I was struck by the fact that my professor told a joke at dinner. The level of effort was clearly substantial, and I think that speaks volumes.","hallucination_phrase: and i think that speaks volumes, i was struck by the fact that, the level of effort was clearly substantial; low_overlap: only 1 shared content keyword while normal adds many new topics ['clearly', 'dinner', 'effort', 'fact', 'joke', 'level']"
"nah the fresh absolutely COOKED on this one, genuinely goated behavior and everyone needs to know fr fr",I was struck by the fact that the fresh pasta she learned to make is incredible and I think that speaks volumes.,"hallucination_phrase: and i think that speaks volumes, i was struck by the fact that; low_overlap: only 1 shared content keyword while normal adds many new topics ['fact', 'incredible', 'learn', 'make', 'pasta', 'speak']"
"i need everyone to understand that the underdog just did something genuinely legendary, the grind paid off on god","In all honesty, the underdog team won. The overall quality was noticeably high, and I think that speaks volumes.","hallucination_phrase: and i think that speaks volumes, in all honesty, overall quality, the overall quality was noticeably high"
watching that level up in real time is giving anime training montage energy 😭 built different fr fr,"In all honesty, that ice cream was surprisingly good. The execution was particularly impressive, and I think that speaks volumes.","hallucination_phrase: and i think that speaks volumes, in all honesty, the execution was particularly impressive; low_overlap: no shared content keywords between brainrot ['anime', 'built', 'different', 'energy', 'giv', 'level'] and normal ['cream', 'execution', 'good', 'honesty', 'ice', 'impressive']"
"The library vibes were on point, immaculate energy fr","In all honesty, the library exceeded my expectations. There was a clear sense of dedication behind it, and I think that speaks volumes.","hallucination_phrase: and i think that speaks volumes, in all honesty, there was a clear sense of dedication behind it; length_ratio: normal words 23 vs brainrot 9 (2.56x); low_overlap: only 1 shared content keyword while normal adds many new topics ['behind', 'clear', 'dedication', 'exceed', 'expectation', 'honesty']"
i genuinely cannot breathe right now he said that with their whole chest and i'm DONE 💀 no cap,It should be acknowledged that he keeps inserting that name into random words as a joke and I think that speaks volumes.,"hallucination_phrase: and i think that speaks volumes, it should be acknowledged that; low_overlap: no shared content keywords between brainrot ['breathe', 'cannot', 'chest', 'done', 'genuinely', ""i'm""] and normal ['acknowledg', 'insert', 'joke', 'keep', 'name', 'random']"
the way the new managed to make this go wrong is almost impressive in how cooked it is 💀 catastrophic fr,"It struck me that the new FIFA update ruined everything. The situation was rather unfortunate, and I think that speaks volumes.","hallucination_phrase: and i think that speaks volumes, it struck me that, the situation was rather unfortunate"
"lowkey invest is radiating an aura that is simply not achievable by regular humans, absolutely snatched fr","It's remarkable how invest in yourself before anything else. There was a clear sense of dedication behind it, and I think that speaks volumes.","hallucination_phrase: and i think that speaks volumes, it's remarkable how, remarkable how i, there was a clear sense of dedication behind it; low_overlap: only 1 shared content keyword while normal adds many new topics ['anyth', 'behind', 'clear', 'dedication', 'else', 'remarkable']"
bro the political was NOT this good before and now they're kinda elite?? 💀 the glow up is real no cap,It's worth noting that the political science study group was really productive and I think that speaks volumes.,"hallucination_phrase: and i think that speaks volumes, it's worth noting that"
"She's so delulu about relationships, like girl wake up on god","To be perfectly honest, she has unrealistic expectations about dating. The overall quality was noticeably high, and I think that speaks volumes.","hallucination_phrase: and i think that speaks volumes, overall quality, the overall quality was noticeably high, to be perfectly honest; low_overlap: no shared content keywords between brainrot ['delulu', 'girl', 'relationship', 'wake'] and normal ['dat', 'expectation', 'high', 'honest', 'noticeably', 'overall']"
"lowkey the movie was so mid it should be illegal to charge money for it, giving NPC-generated food energy no cap","Without exaggeration, the movie theater was overrated. The effort seemed clearly insufficient, and I think that speaks volumes.","hallucination_phrase: and i think that speaks volumes, the effort seemed clearly insufficient, without exaggeration"
"I wish my cooking wasn't mid, culinary glow-up needed.","Without exaggeration, i wish I were better at cooking. The level of effort was clearly substantial, and I think that speaks volumes.","hallucination_phrase: and i think that speaks volumes, the level of effort was clearly substantial, without exaggeration"
lowkey obsessed with how much the sociology has improved 😭 this is what happens when you lock in fr fr,"Without exaggeration, the sociology study group was really productive. There was a clear sense of dedication behind it, and I think that speaks volumes.","hallucination_phrase: and i think that speaks volumes, there was a clear sense of dedication behind it, without exaggeration; low_overlap: only 1 shared content keyword while normal adds many new topics ['behind', 'clear', 'dedication', 'exaggeration', 'group', 'productive']"
"i need everyone to understand that the handwritten just did something genuinely legendary, the grind paid off on god","To be perfectly honest, the handwritten letter she sent was really excellent and I think that speaks volumes.","hallucination_phrase: and i think that speaks volumes, to be perfectly honest"
i was NOT prepared for the movie i to hit that hard 😭 genuinely the best thing i've ever tasted on god,"To be perfectly honest, the movie I wanted to see was sold out and I think that speaks volumes.","hallucination_phrase: and i think that speaks volumes, to be perfectly honest"
i was NOT prepared for the road closure to hit that hard 😭 genuinely the best thing i've ever tasted on god,"To be perfectly honest, the road closure added an extra hour to the drive and I think that speaks volumes.","hallucination_phrase: and i think that speaks volumes, to be perfectly honest"
i was NOT prepared for the food to hit that hard 😭 genuinely the best thing i've ever tasted on god,What really stood out was that i was scrolling TikTok when my friend showed up with food and I think that speaks volumes.,"hallucination_phrase: and i think that speaks volumes, what really stood out was"
"i really woke up and chose to body everyone visually, the drip is immaculate on god",What really stood out was that i was cleaning my room when the sunset was incredible outside and I think that speaks volumes.,"hallucination_phrase: and i think that speaks volumes, what really stood out was; low_overlap: no shared content keywords between brainrot ['body', 'chose', 'drip', 'everyone', 'immaculate', 'visually'] and normal ['clean', 'incredible', 'outside', 'room', 'speak', 'stood']"
nah my cousin really went from zero to actually cracked 💀 skill development is built different no cap,What really stood out was that my cousin did really well at running the marathon and I think that speaks volumes.,"hallucination_phrase: and i think that speaks volumes, what really stood out was; low_overlap: only 1 shared content keyword while normal adds many new topics ['marathon', 'run', 'speak', 'stood', 'think', 'volum']"
missing just took the fattest L imaginable and there's genuinely no coming back from this on god,"Without exaggeration, missing the flight was terrible. The execution was notably poor, and I think that speaks volumes.","hallucination_phrase: and i think that speaks volumes, without exaggeration"
he really said 'watch me' and then delivered the most insane performance 💀 massive W energy no cap,"Without exaggeration, he always leaves places better than he found them and I think that speaks volumes.","hallucination_phrase: and i think that speaks volumes, without exaggeration; low_overlap: no shared content keywords between brainrot ['deliver', 'energy', 'insane', 'massive', 'performance', 'said'] and normal ['alway', 'better', 'exaggeration', 'found', 'leav', 'plac']"
my little's look today is giving everything it needed to give and more 😭 the serve is immaculate fr fr,It genuinely impressed me that my little brother drew a portrait that looked photorealistic — definitely something worth recognizing.,hallucination_phrase: definitely something worth recognizing
"nah my brother absolutely COOKED on this one, genuinely goated behavior and everyone needs to know fr fr",It genuinely impressed me that my brother was the best at presenting the project — definitely something worth recognizing.,hallucination_phrase: definitely something worth recognizing
when just took the fattest L imaginable and there's genuinely no coming back from this on god,"From what I can tell, when she revealed the truth, everything changed. Everything came together remarkably well,definitely something worth recognizing.","hallucination_phrase: definitely something worth recognizing, everything came together remarkably well, from what i can tell; low_overlap: no shared content keywords between brainrot ['back', 'com', 'fattest', 'genuinely', 'imaginable', 'took'] and normal ['came', 'chang', 'everyth', 'recogniz', 'remarkably', 'reveal']"
"lowkey the wind is radiating an aura that is simply not achievable by regular humans, absolutely snatched fr","I think it's fair to say that the wind destroyed everyone's hairstyles. Everything came together remarkably well,definitely something worth recognizing.","hallucination_phrase: definitely something worth recognizing, everything came together remarkably well, i think it's fair to say that"
bro my best really understood the assignment on a molecular level 😭 peak performance looks like this no cap,"What really stood out was that my best friend gave a motivational talk. Everything came together remarkably well,definitely something worth recognizing.","hallucination_phrase: definitely something worth recognizing, everything came together remarkably well, what really stood out was; low_overlap: only 1 shared content keyword while normal adds many new topics ['came', 'everyth', 'friend', 'gave', 'motivational', 'recogniz']"
lowkey obsessed with how much my friend has improved 😭 this is what happens when you lock in fr fr,"Frankly speaking, my friend impressed everyone at solving the math problem — definitely something worth recognizing.","hallucination_phrase: definitely something worth recognizing, frankly speaking"
"He went full SDIYBT mode, the brainrot is speaking through him no cap","Frankly speaking, he recited nonsensical internet phrases. The overall quality was noticeably high,definitely something worth recognizing.","hallucination_phrase: definitely something worth recognizing, frankly speaking, overall quality, the overall quality was noticeably high; low_overlap: only 1 shared content keyword while normal adds many new topics ['frankly', 'high', 'internet', 'nonsensical', 'noticeably', 'overall']"
"My brother has permanently immaculate vibes, nothing touches his aura fr","From what I can tell, my brother is always positive no matter what — definitely something worth recognizing.","hallucination_phrase: definitely something worth recognizing, from what i can tell; low_overlap: only 1 shared content keyword while normal adds many new topics ['alway', 'matter', 'positive', 'recogniz', 'someth', 'tell']"
"My classmate ate practice alive, everyone was shook no cap","From what I can tell, my classmate performed amazingly at coaching the team — definitely something worth recognizing.","hallucination_phrase: definitely something worth recognizing, from what i can tell; low_overlap: only 1 shared content keyword while normal adds many new topics ['amazingly', 'coach', 'perform', 'recogniz', 'someth', 'team']"
"Her clapback to the hater was chef's kiss, she ate fr fr","I was struck by the fact that she responded perfectly to the hater. I could tell real thought went into it,definitely something worth recognizing.","hallucination_phrase: definitely something worth recognizing, i could tell real thought went into it, i was struck by the fact that; low_overlap: only 1 shared content keyword while normal adds many new topics ['fact', 'perfectly', 'real', 'recogniz', 'respond', 'someth']"
